{
  "formatVersion": "0.2",
  "components": [
    {
      "id": "terrain",
      "status": "implemented",
      "description": "Flat stylised ground patch.",
      "params": {
        "type": "object",
        "additionalProperties": false,
        "required": [
          "size"
        ],
        "properties": {
          "size": {
            "type": "number",
            "minimum": 1,
            "maximum": 10000,
            "x-unit": "scene",
            "description": "Side of the square patch."
          },
          "surface": {
            "type": "string",
            "enum": [
              "grass",
              "concrete",
              "sand"
            ],
            "default": "grass",
            "description": "Surface style."
          }
        }
      },
      "capabilities": [
        "lod"
      ]
    },
    {
      "id": "house",
      "status": "implemented",
      "description": "Stylised house with a pitched roof. Decor.",
      "params": {
        "type": "object",
        "additionalProperties": false,
        "required": [
          "width",
          "depth",
          "wallHeight"
        ],
        "properties": {
          "width": {
            "type": "number",
            "minimum": 3,
            "maximum": 30,
            "x-unit": "m",
            "description": "Facade width."
          },
          "depth": {
            "type": "number",
            "minimum": 3,
            "maximum": 30,
            "x-unit": "m",
            "description": "Depth."
          },
          "wallHeight": {
            "type": "number",
            "minimum": 2,
            "maximum": 15,
            "x-unit": "m",
            "description": "Height of the walls under the roof."
          },
          "roofPitchDeg": {
            "type": "number",
            "minimum": 0,
            "maximum": 50,
            "default": 30,
            "x-unit": "deg",
            "description": "Roof slope."
          }
        }
      },
      "capabilities": [
        "cutaway",
        "lod"
      ]
    },
    {
      "id": "flat-panel-terminal",
      "status": "implemented",
      "description": "Flat rectangular satellite user terminal (radome + housing) on a mount. Children entities sit inside and appear on cutaway.",
      "params": {
        "type": "object",
        "additionalProperties": false,
        "required": [
          "width",
          "height",
          "thickness"
        ],
        "properties": {
          "width": {
            "type": "number",
            "minimum": 0.1,
            "maximum": 2,
            "x-unit": "m",
            "description": "Panel long side."
          },
          "height": {
            "type": "number",
            "minimum": 0.1,
            "maximum": 2,
            "x-unit": "m",
            "description": "Panel short side."
          },
          "thickness": {
            "type": "number",
            "minimum": 0.01,
            "maximum": 0.2,
            "x-unit": "m",
            "description": "Panel thickness."
          },
          "mount": {
            "type": "string",
            "enum": [
              "kickstand",
              "pipe",
              "none"
            ],
            "default": "pipe",
            "description": "Mount style."
          },
          "tiltDeg": {
            "type": "number",
            "minimum": 0,
            "maximum": 90,
            "default": 20,
            "x-unit": "deg",
            "description": "Tilt from horizontal (fixed, not motorised)."
          }
        }
      },
      "capabilities": [
        "cutaway",
        "explode",
        "lod"
      ]
    },
    {
      "id": "antenna-element-array",
      "status": "implemented",
      "description": "Planar array of identical radiating elements (patches), on a lattice. Represents the visible layer; the wave simulator works on a linear cut of it.",
      "params": {
        "type": "object",
        "additionalProperties": false,
        "required": [
          "lattice",
          "count",
          "spacing"
        ],
        "properties": {
          "lattice": {
            "type": "string",
            "enum": [
              "square",
              "hexagonal"
            ],
            "description": "Element lattice."
          },
          "count": {
            "type": "integer",
            "minimum": 4,
            "maximum": 5000,
            "x-unit": "1",
            "description": "Number of elements displayed."
          },
          "spacing": {
            "type": "number",
            "minimum": 0.001,
            "maximum": 0.1,
            "x-unit": "m",
            "description": "Centre-to-centre element spacing."
          },
          "elementShape": {
            "type": "string",
            "enum": [
              "square-patch",
              "circular-patch"
            ],
            "default": "circular-patch",
            "description": "Element shape."
          }
        }
      },
      "capabilities": [
        "lod"
      ]
    },
    {
      "id": "patch-element",
      "status": "implemented",
      "description": "One radiating element: square copper patch on an insulating tile, copper ground plane underneath, optional probe feed through the tile. Lies in the (x, z) plane, radiates towards +y. Cutaway removes the front half to show the feed.",
      "params": {
        "type": "object",
        "additionalProperties": false,
        "required": [
          "patchSize",
          "tileSize",
          "substrateThickness"
        ],
        "properties": {
          "patchSize": {
            "type": "number",
            "minimum": 0.001,
            "maximum": 0.05,
            "x-unit": "m",
            "description": "Side of the square copper patch."
          },
          "tileSize": {
            "type": "number",
            "minimum": 0.001,
            "maximum": 0.1,
            "x-unit": "m",
            "description": "Side of the insulating tile (usually the array spacing)."
          },
          "substrateThickness": {
            "type": "number",
            "minimum": 0.0001,
            "maximum": 0.01,
            "x-unit": "m",
            "description": "Thickness of the insulating layer between patch and ground plane."
          },
          "feed": {
            "type": "string",
            "enum": [
              "probe",
              "none"
            ],
            "default": "probe",
            "description": "How the signal reaches the patch."
          }
        }
      },
      "capabilities": [
        "cutaway",
        "lod"
      ]
    },
    {
      "id": "ic-chip-grid",
      "status": "implemented",
      "description": "Grid of identical integrated circuits on a board (e.g. beamformer chips).",
      "params": {
        "type": "object",
        "additionalProperties": false,
        "required": [
          "count",
          "chipSize"
        ],
        "properties": {
          "count": {
            "type": "integer",
            "minimum": 1,
            "maximum": 500,
            "x-unit": "1",
            "description": "Number of chips displayed."
          },
          "chipSize": {
            "type": "number",
            "minimum": 0.001,
            "maximum": 0.05,
            "x-unit": "m",
            "description": "Chip side."
          }
        }
      },
      "capabilities": [
        "lod"
      ]
    },
    {
      "id": "electronics-module",
      "status": "implemented",
      "description": "Generic board area with a few chips and connectors, tinted by role.",
      "params": {
        "type": "object",
        "additionalProperties": false,
        "required": [
          "role",
          "width",
          "depth"
        ],
        "properties": {
          "role": {
            "type": "string",
            "enum": [
              "modem",
              "power",
              "heater",
              "generic"
            ],
            "description": "Visual variant."
          },
          "width": {
            "type": "number",
            "minimum": 0.005,
            "maximum": 1,
            "x-unit": "m",
            "description": "Width."
          },
          "depth": {
            "type": "number",
            "minimum": 0.005,
            "maximum": 1,
            "x-unit": "m",
            "description": "Depth."
          }
        }
      },
      "capabilities": [
        "lod"
      ]
    },
    {
      "id": "wifi-router",
      "status": "implemented",
      "description": "Indoor Wi-Fi router box.",
      "params": {
        "type": "object",
        "additionalProperties": false,
        "required": [
          "height"
        ],
        "properties": {
          "height": {
            "type": "number",
            "minimum": 0.05,
            "maximum": 0.5,
            "x-unit": "m",
            "description": "Box height."
          },
          "showRadiation": {
            "type": "boolean",
            "default": false,
            "description": "Draw stylised Wi-Fi rings."
          }
        }
      }
    },
    {
      "id": "cable",
      "status": "implemented",
      "description": "Cable between two entities, routed along a sagging curve.",
      "params": {
        "type": "object",
        "additionalProperties": false,
        "required": [
          "from",
          "to"
        ],
        "properties": {
          "from": {
            "type": "string",
            "x-ref": "entity",
            "description": "Start entity."
          },
          "to": {
            "type": "string",
            "x-ref": "entity",
            "description": "End entity."
          },
          "sag": {
            "type": "number",
            "minimum": 0,
            "maximum": 1,
            "default": 0.2,
            "x-unit": "1",
            "description": "Sag relative to length."
          }
        }
      }
    },
    {
      "id": "leo-satellite",